#CODEVALUEMODEL=CodeValueIcd9|CODESYSTEMID=2.16.840.1.113883.6.104|CODESYSTEMNAME=ICD9PROC|CODESYSTEMDISPLAYNAME=ICD9 PRESTAZIONI|VERSION=2002|DESCRIPTION=ICD9 Procedure Codes|LANGUAGE=it|AUTHORITYNAME=National Center for Health Statistics|AUTHORITYDESCRIPTION=World Health Organization|AUTHORITYCONTACTINFORMATION=http://www.cdc.gov/nchs/icd9.htm|VALIDFROM=22/04/2010 10:22
83.4.5_V2002|83.45|Altra miectomia|Altra miectomia|C|0|1|||Altra miectomia||22/04/2010 10:22|
83.4.9_V2002|83.49|Altra asportazione di tessuti molli|Altra asportazione di tessuti molli|C|0|1|||Altra asportazione di tessuti molli||22/04/2010 10:22|
83.5_V2002|83.5|Borsectomia|Borsectomia|S|0|1|||Borsectomia||22/04/2010 10:22|
83.6_V2002|83.6|Sutura di muscoli, tendini e fasce|Sutura di muscoli, tendini e fasce|S|0|1|||Sutura di muscoli, tendini e fasce||22/04/2010 10:22|
83.6.1_V2002|83.61|Sutura di guaina tendinea|Sutura di guaina tendinea|C|0|1|||Sutura di guaina tendinea||22/04/2010 10:22|
83.6.2_V2002|83.62|Sutura differita di tendini|Sutura differita di tendini|C|0|1|||Sutura differita di tendini||22/04/2010 10:22|
83.6.3_V2002|83.63|Riparazione della cuffia dei rotatori|Riparazione della cuffia dei rotatori|C|0|1|||Riparazione della cuffia dei rotatori||22/04/2010 10:22|
83.6.4_V2002|83.64|Altra sutura di tendini|Altra sutura di tendini|C|0|1|||Altra sutura di tendini||22/04/2010 10:22|
83.6.5_V2002|83.65|Altra sutura di muscoli o fasce Riparazione di diastasi dei retti|Altra sutura di muscoli o fasce Riparazione di diastasi dei retti|C|0|1|||Altra sutura di muscoli o fasce Riparazione di diastasi dei retti||22/04/2010 10:22|
83.7_V2002|83.7|Ricostruzione di muscoli e tendini|Ricostruzione di muscoli e tendini|S|0|1|||Ricostruzione di muscoli e tendini||22/04/2010 10:22|
83.7.1_V2002|83.71|Avanzamento di tendini|Avanzamento di tendini|C|0|1|||Avanzamento di tendini||22/04/2010 10:22|
83.7.2_V2002|83.72|Arretramento di tendini|Arretramento di tendini|C|0|1|||Arretramento di tendini||22/04/2010 10:22|
83.7.3_V2002|83.73|Reinserzione di tendini|Reinserzione di tendini|C|0|1|||Reinserzione di tendini||22/04/2010 10:22|
83.7.4_V2002|83.74|Reinserzione di muscoli|Reinserzione di muscoli|C|0|1|||Reinserzione di muscoli||22/04/2010 10:22|
83.7.5_V2002|83.75|Trasposizione o trapianto di tendini|Trasposizione o trapianto di tendini|C|0|1|||Trasposizione o trapianto di tendini||22/04/2010 10:22|
83.7.6_V2002|83.76|Altra trasposizione di tendini|Altra trasposizione di tendini|C|0|1|||Altra trasposizione di tendini||22/04/2010 10:22|
83.7.7_V2002|83.77|Trasposizione o trapianto di muscoli|Trasposizione o trapianto di muscoli|C|0|1|||Trasposizione o trapianto di muscoli||22/04/2010 10:22|
83.7.9_V2002|83.79|Altra trasposizione di muscoli|Altra trasposizione di muscoli|C|0|1|||Altra trasposizione di muscoli||22/04/2010 10:22|
83.8_V2002|83.8|Altri interventi di plastica su muscoli, tendini e fasce|Altri interventi di plastica su muscoli, tendini e fasce|S|0|1|||Altri interventi di plastica su muscoli, tendini e fasce||22/04/2010 10:22|
83.8.1_V2002|83.81|Innesto tendineo|Innesto tendineo|C|0|1|||Innesto tendineo||22/04/2010 10:22|
83.8.2_V2002|83.82|Innesto di muscoli o fasce|Innesto di muscoli o fasce|C|0|1|||Innesto di muscoli o fasce||22/04/2010 10:22|
83.8.3_V2002|83.83|Ricostruzione di puleggia tendinea|Ricostruzione di puleggia tendinea|C|0|1|||Ricostruzione di puleggia tendinea||22/04/2010 10:22|
83.8.4_V2002|83.84|Correzione di piede torto, non classificato altrove|Correzione di piede torto, non classificato altrove|C|0|1|||Correzione di piede torto, non classificato altrove||22/04/2010 10:22|
83.8.5_V2002|83.85|Altri cambiamenti di lunghezza di muscoli e tendini|Altri cambiamenti di lunghezza di muscoli e tendini|C|0|1|||Altri cambiamenti di lunghezza di muscoli e tendini||22/04/2010 10:22|
83.8.6_V2002|83.86|Plastica del quadricipite|Plastica del quadricipite|C|0|1|||Plastica del quadricipite||22/04/2010 10:22|
83.8.7_V2002|83.87|Altri interventi di plastica sui muscoli|Altri interventi di plastica sui muscoli|C|0|1|||Altri interventi di plastica sui muscoli||22/04/2010 10:22|
83.8.8_V2002|83.88|Altri interventi di plastica sui tendini|Altri interventi di plastica sui tendini|C|0|1|||Altri interventi di plastica sui tendini||22/04/2010 10:22|
83.8.9_V2002|83.89|Altri interventi di plastica sulle fasce|Altri interventi di plastica sulle fasce|C|0|1|||Altri interventi di plastica sulle fasce||22/04/2010 10:22|
83.9_V2002|83.9|Altri interventi su muscoli, tendini, fasce e borse|Altri interventi su muscoli, tendini, fasce e borse|S|0|1|||Altri interventi su muscoli, tendini, fasce e borse||22/04/2010 10:22|
83.9.1_V2002|83.91|Lisi di aderenze di muscoli, tendini, fasce e borse|Lisi di aderenze di muscoli, tendini, fasce e borse|C|0|1|||Lisi di aderenze di muscoli, tendini, fasce e borse||22/04/2010 10:22|
83.9.2_V2002|83.92|Inserzione o sostituzione di stimolatore dei muscoli scheletrici|Inserzione o sostituzione di stimolatore dei muscoli scheletrici|C|0|1|||Inserzione o sostituzione di stimolatore dei muscoli scheletrici||22/04/2010 10:22|
83.9.3_V2002|83.93|Rimozione di stimolatore dei muscoli scheletrici|Rimozione di stimolatore dei muscoli scheletrici|C|0|1|||Rimozione di stimolatore dei muscoli scheletrici||22/04/2010 10:22|
83.9.4_V2002|83.94|Aspirazione di borse|Aspirazione di borse|C|0|1|||Aspirazione di borse||22/04/2010 10:22|
83.9.5_V2002|83.95|Aspirazione di altri tessuti molli|Aspirazione di altri tessuti molli|C|0|1|||Aspirazione di altri tessuti molli||22/04/2010 10:22|
83.9.6_V2002|83.96|Iniezione di sostanze terapeutiche all'interno delle borse|Iniezione di sostanze terapeutiche all'interno delle borse|C|0|1|||Iniezione di sostanze terapeutiche all'interno delle borse||22/04/2010 10:22|
83.9.7_V2002|83.97|Iniezione di sostanze terapeutiche all'interno dei tendini|Iniezione di sostanze terapeutiche all'interno dei tendini|C|0|1|||Iniezione di sostanze terapeutiche all'interno dei tendini||22/04/2010 10:22|
83.9.8_V2002|83.98|Iniezione di sostanze terapeutiche ad azione locale all'interno di altri tessuti molli|Iniezione di sostanze terapeutiche ad azione locale all'interno di altri tessuti molli|C|0|1|||Iniezione di sostanze terapeutiche ad azione locale all'interno di altri tessuti molli||22/04/2010 10:22|
83.9.9_V2002|83.99|Altri interventi su muscoli, tendini, fasce e borse|Altri interventi su muscoli, tendini, fasce e borse|C|0|1|||Altri interventi su muscoli, tendini, fasce e borse||22/04/2010 10:22|
84_V2002|-|Altri interventi sull'apparato muscoloscheletrico -|Altri interventi sull'apparato muscoloscheletrico|T|0|1|||Altri interventi sull'apparato muscoloscheletrico||22/04/2010 10:22|
84.0_V2002|84.0|Amputazione dell'arto superiore|Amputazione dell'arto superiore|S|0|1|||Amputazione dell'arto superiore||22/04/2010 10:22|
84.0.0_V2002|84.00|Amputazione dell'arto superiore, SAI|Amputazione dell'arto superiore, SAI|C|0|1|||Amputazione dell'arto superiore, SAI||22/04/2010 10:22|
84.0.1_V2002|84.01|Amputazione e disarticolazione di dita della mano|Amputazione e disarticolazione di dita della mano|C|0|1|||Amputazione e disarticolazione di dita della mano||22/04/2010 10:22|
84.0.2_V2002|84.02|Amputazione e disarticolazione del pollice|Amputazione e disarticolazione del pollice|C|0|1|||Amputazione e disarticolazione del pollice||22/04/2010 10:22|
84.0.3_V2002|84.03|Amputazione a livello della mano|Amputazione a livello della mano|C|0|1|||Amputazione a livello della mano||22/04/2010 10:22|
84.0.4_V2002|84.04|Disarticolazione del polso|Disarticolazione del polso|C|0|1|||Disarticolazione del polso||22/04/2010 10:22|
84.0.5_V2002|84.05|Amputazione a livello dell'avambraccio|Amputazione a livello dell'avambraccio|C|0|1|||Amputazione a livello dell'avambraccio||22/04/2010 10:22|
84.0.6_V2002|84.06|Disarticolazione del gomito|Disarticolazione del gomito|C|0|1|||Disarticolazione del gomito||22/04/2010 10:22|
84.0.7_V2002|84.07|Amputazione a livello dell'omero|Amputazione a livello dell'omero|C|0|1|||Amputazione a livello dell'omero||22/04/2010 10:22|
84.0.8_V2002|84.08|Disarticolazione della spalla|Disarticolazione della spalla|C|0|1|||Disarticolazione della spalla||22/04/2010 10:22|
84.0.9_V2002|84.09|Amputazione interscapolotoracica|Amputazione interscapolotoracica|C|0|1|||Amputazione interscapolotoracica||22/04/2010 10:22|
84.1_V2002|84.1|Amputazione dell'arto inferiore|Amputazione dell'arto inferiore|S|0|1|||Amputazione dell'arto inferiore||22/04/2010 10:22|
84.1.0_V2002|84.10|Amputazione dell'arto inferiore, SAI|Amputazione dell'arto inferiore, SAI|C|0|1|||Amputazione dell'arto inferiore, SAI||22/04/2010 10:22|
84.1.1_V2002|84.11|Amputazione di dita del piede|Amputazione di dita del piede|C|0|1|||Amputazione di dita del piede||22/04/2010 10:22|
84.1.2_V2002|84.12|Amputazione a livello del piede|Amputazione a livello del piede|C|0|1|||Amputazione a livello del piede||22/04/2010 10:22|
84.1.3_V2002|84.13|Disarticolazione della caviglia|Disarticolazione della caviglia|C|0|1|||Disarticolazione della caviglia||22/04/2010 10:22|
84.1.4_V2002|84.14|Amputazione della caviglia a livello dei malleoli della tibia e fibula|Amputazione della caviglia a livello dei malleoli della tibia e fibula|C|0|1|||Amputazione della caviglia a livello dei malleoli della tibia e fibula||22/04/2010 10:22|
84.1.5_V2002|84.15|Altra amputazione al di sotto del ginocchio|Altra amputazione al di sotto del ginocchio|C|0|1|||Altra amputazione al di sotto del ginocchio||22/04/2010 10:22|
84.1.6_V2002|84.16|Disarticolazione del ginocchio|Disarticolazione del ginocchio|C|0|1|||Disarticolazione del ginocchio||22/04/2010 10:22|
84.1.7_V2002|84.17|Amputazione al di sopra del ginocchio|Amputazione al di sopra del ginocchio|C|0|1|||Amputazione al di sopra del ginocchio||22/04/2010 10:22|
84.1.8_V2002|84.18|Disarticolazione dell'anca|Disarticolazione dell'anca|C|0|1|||Disarticolazione dell'anca||22/04/2010 10:22|
84.1.9_V2002|84.19|Amputazione addomino-pelvica|Amputazione addomino-pelvica|C|0|1|||Amputazione addomino-pelvica||22/04/2010 10:22|
84.2_V2002|84.2|Reimpianto di arti staccati|Reimpianto di arti staccati|S|0|1|||Reimpianto di arti staccati||22/04/2010 10:22|
84.2.1_V2002|84.21|Reimpianto del pollice della mano|Reimpianto del pollice della mano|C|0|1|||Reimpianto del pollice della mano||22/04/2010 10:22|
84.2.2_V2002|84.22|Reimpianto di dita della mano|Reimpianto di dita della mano|C|0|1|||Reimpianto di dita della mano||22/04/2010 10:22|
84.2.3_V2002|84.23|Reimpianto di avambraccio, polso o mano|Reimpianto di avambraccio, polso o mano|C|0|1|||Reimpianto di avambraccio, polso o mano||22/04/2010 10:22|
84.2.4_V2002|84.24|Reimpianto dell'arto superiore|Reimpianto dell'arto superiore|C|0|1|||Reimpianto dell'arto superiore||22/04/2010 10:22|
84.2.5_V2002|84.25|Reimpianto di dito del piede|Reimpianto di dito del piede|C|0|1|||Reimpianto di dito del piede||22/04/2010 10:22|
84.2.6_V2002|84.26|Reimpianto del piede|Reimpianto del piede|C|0|1|||Reimpianto del piede||22/04/2010 10:22|
84.2.7_V2002|84.27|Reimpianto della gamba o della caviglia|Reimpianto della gamba o della caviglia|C|0|1|||Reimpianto della gamba o della caviglia||22/04/2010 10:22|
84.2.8_V2002|84.28|Reimpianto della coscia|Reimpianto della coscia|C|0|1|||Reimpianto della coscia||22/04/2010 10:22|
84.2.9_V2002|84.29|Altro reimpianto|Altro reimpianto|C|0|1|||Altro reimpianto||22/04/2010 10:22|
84.3_V2002|84.3|Revisione del moncone di amputazione|Revisione del moncone di amputazione|S|0|1|||Revisione del moncone di amputazione||22/04/2010 10:22|
84.4_V2002|84.4|Impianto o adattamento di protesi di arto|Impianto o adattamento di protesi di arto|S|0|1|||Impianto o adattamento di protesi di arto||22/04/2010 10:22|
84.4.0_V2002|84.40|Impianto o adattamento di protesi di arto SAI|Impianto o adattamento di protesi di arto SAI|C|0|1|||Impianto o adattamento di protesi di arto SAI||22/04/2010 10:22|
84.4.1_V2002|84.41|Adattamento di protesi di arto superiore e spalla|Adattamento di protesi di arto superiore e spalla|C|0|1|||Adattamento di protesi di arto superiore e spalla||22/04/2010 10:22|
84.4.2_V2002|84.42|Adattamento di protesi dell'avambraccio e della mano|Adattamento di protesi dell'avambraccio e della mano|C|0|1|||Adattamento di protesi dell'avambraccio e della mano||22/04/2010 10:22|
84.4.3_V2002|84.43|Adattamento di protesi del braccio, SAI|Adattamento di protesi del braccio, SAI|C|0|1|||Adattamento di protesi del braccio, SAI||22/04/2010 10:22|
84.4.4_V2002|84.44|Impianto di protesi del braccio|Impianto di protesi del braccio|C|0|1|||Impianto di protesi del braccio||22/04/2010 10:22|
84.4.5_V2002|84.45|Adattamento di protesi al di sopra del ginocchio|Adattamento di protesi al di sopra del ginocchio|C|0|1|||Adattamento di protesi al di sopra del ginocchio||22/04/2010 10:22|
84.4.6_V2002|84.46|Adattamento di protesi al di sotto del ginocchio|Adattamento di protesi al di sotto del ginocchio|C|0|1|||Adattamento di protesi al di sotto del ginocchio||22/04/2010 10:22|
84.4.7_V2002|84.47|Adattamento di protesi della gamba, SAI|Adattamento di protesi della gamba, SAI|C|0|1|||Adattamento di protesi della gamba, SAI||22/04/2010 10:22|
84.4.8_V2002|84.48|Impianto di protesi della gamba|Impianto di protesi della gamba|C|0|1|||Impianto di protesi della gamba||22/04/2010 10:22|
84.9_V2002|84.9|Altri interventi sull'apparato muscoloscheletrico|Altri interventi sull'apparato muscoloscheletrico|S|0|1|||Altri interventi sull'apparato muscoloscheletrico||22/04/2010 10:22|
84.9.1_V2002|84.91|Amputazione, SAI|Amputazione, SAI|C|0|1|||Amputazione, SAI||22/04/2010 10:22|
84.9.2_V2002|84.92|Separazione di gemelli siamesi uguali|Separazione di gemelli siamesi uguali|C|0|1|||Separazione di gemelli siamesi uguali||22/04/2010 10:22|
84.9.3_V2002|84.93|Separazione di gemelli siamesi diseguali|Separazione di gemelli siamesi diseguali|C|0|1|||Separazione di gemelli siamesi diseguali||22/04/2010 10:22|
84.9.9_V2002|84.99|Altri interventi sull'apparato muscoloscheletrico|Altri interventi sull'apparato muscoloscheletrico|C|0|1|||Altri interventi sull'apparato muscoloscheletrico||22/04/2010 10:22|
85_V2002|-|Interventi sulla mammella|Interventi sulla mammella|T|0|1|||Interventi sulla mammella||22/04/2010 10:22|
85.0_V2002|85.0|Mastotomia|Mastotomia|S|0|1|||Mastotomia||22/04/2010 10:22|
85.1_V2002|85.1|Procedure diagnostiche sulla mammella|Procedure diagnostiche sulla mammella|S|0|1|||Procedure diagnostiche sulla mammella||22/04/2010 10:22|
85.1.1_V2002|85.11|Biopsia [percutanea] [agobiopsia] della mammella|Biopsia [percutanea] [agobiopsia] della mammella|C|0|1|||Biopsia [percutanea] [agobiopsia] della mammella||22/04/2010 10:22|
85.1.2_V2002|85.12|Biopsia a cielo aperto della mammella|Biopsia a cielo aperto della mammella|C|0|1|||Biopsia a cielo aperto della mammella||22/04/2010 10:22|
85.1.9_V2002|85.19|Altre procedure diagnostiche sulla mammella|Altre procedure diagnostiche sulla mammella|C|0|1|||Altre procedure diagnostiche sulla mammella||22/04/2010 10:22|
85.2_V2002|85.2|Asportazione o demolizione di tessuto della mammella|Asportazione o demolizione di tessuto della mammella|S|0|1|||Asportazione o demolizione di tessuto della mammella||22/04/2010 10:22|
85.2.0_V2002|85.20|Asportazione o demolizione di tessuto della mammella, SAI|Asportazione o demolizione di tessuto della mammella, SAI|C|0|1|||Asportazione o demolizione di tessuto della mammella, SAI||22/04/2010 10:22|
85.2.1_V2002|85.21|Asportazione locale di lesione della mammella|Asportazione locale di lesione della mammella|C|0|1|||Asportazione locale di lesione della mammella||22/04/2010 10:22|
85.2.2_V2002|85.22|Quadrantectomia della mammella|Quadrantectomia della mammella|C|0|1|||Quadrantectomia della mammella||22/04/2010 10:22|
85.2.3_V2002|85.23|Mastectomia subtotale|Mastectomia subtotale|C|0|1|||Mastectomia subtotale||22/04/2010 10:22|
85.2.4_V2002|85.24|Asportazione di tessuto ectopico della mammella|Asportazione di tessuto ectopico della mammella|C|0|1|||Asportazione di tessuto ectopico della mammella||22/04/2010 10:22|
85.2.5_V2002|85.25|Asportazione del capezzolo|Asportazione del capezzolo|C|0|1|||Asportazione del capezzolo||22/04/2010 10:22|
85.3_V2002|85.3|Mammoplastica riduttiva e mammectomia sottocutanea|Mammoplastica riduttiva e mammectomia sottocutanea|S|0|1|||Mammoplastica riduttiva e mammectomia sottocutanea||22/04/2010 10:22|
85.3.1_V2002|85.31|Mammoplastica riduttiva monolaterale|Mammoplastica riduttiva monolaterale|C|0|1|||Mammoplastica riduttiva monolaterale||22/04/2010 10:22|
85.3.2_V2002|85.32|Mammoplastica riduttiva bilaterale|Mammoplastica riduttiva bilaterale|C|0|1|||Mammoplastica riduttiva bilaterale||22/04/2010 10:22|
85.3.3_V2002|85.33|Mammectomia sottocutanea monolaterale con contemporaneo impianto di protesi|Mammectomia sottocutanea monolaterale con contemporaneo impianto di protesi|C|0|1|||Mammectomia sottocutanea monolaterale con contemporaneo impianto di protesi||22/04/2010 10:22|
85.3.4_V2002|85.34|Altra mammectomia sottocutanea monolaterale|Altra mammectomia sottocutanea monolaterale|C|0|1|||Altra mammectomia sottocutanea monolaterale||22/04/2010 10:22|
85.3.5_V2002|85.35|Mammectomia sottocutanea bilaterale con contemporaneo impianto di protesi|Mammectomia sottocutanea bilaterale con contemporaneo impianto di protesi|C|0|1|||Mammectomia sottocutanea bilaterale con contemporaneo impianto di protesi||22/04/2010 10:22|
85.3.6_V2002|85.36|Altra mammectomia sottocutanea bilaterale|Altra mammectomia sottocutanea bilaterale|C|0|1|||Altra mammectomia sottocutanea bilaterale||22/04/2010 10:22|
85.4_V2002|85.4|Mastectomia|Mastectomia|S|0|1|||Mastectomia||22/04/2010 10:22|
85.4.1_V2002|85.41|Mastectomia semplice monolaterale|Mastectomia semplice monolaterale|C|0|1|||Mastectomia semplice monolaterale||22/04/2010 10:22|
85.4.2_V2002|85.42|Mastectomia semplice bilaterale|Mastectomia semplice bilaterale|C|0|1|||Mastectomia semplice bilaterale||22/04/2010 10:22|
85.4.3_V2002|85.43|Mastectomia semplice allargata monolaterale|Mastectomia semplice allargata monolaterale|C|0|1|||Mastectomia semplice allargata monolaterale||22/04/2010 10:22|
85.4.4_V2002|85.44|Mastectomia semplice allargata bilaterale|Mastectomia semplice allargata bilaterale|C|0|1|||Mastectomia semplice allargata bilaterale||22/04/2010 10:22|
85.4.5_V2002|85.45|Mastectomia radicale monolaterale|Mastectomia radicale monolaterale|C|0|1|||Mastectomia radicale monolaterale||22/04/2010 10:22|
85.4.6_V2002|85.46|Mastectomia radicale bilaterale|Mastectomia radicale bilaterale|C|0|1|||Mastectomia radicale bilaterale||22/04/2010 10:22|
85.4.7_V2002|85.47|Mastectomia radicale monolaterale allargata|Mastectomia radicale monolaterale allargata|C|0|1|||Mastectomia radicale monolaterale allargata||22/04/2010 10:22|
85.4.8_V2002|85.48|Mastectomia radicale bilaterale allargata|Mastectomia radicale bilaterale allargata|C|0|1|||Mastectomia radicale bilaterale allargata||22/04/2010 10:22|
85.5_V2002|85.5|Mammoplastica di ingrandimento|Mammoplastica di ingrandimento|S|0|1|||Mammoplastica di ingrandimento||22/04/2010 10:22|
85.5.0_V2002|85.50|Mammoplastica di ingrandimento, SAI|Mammoplastica di ingrandimento, SAI|C|0|1|||Mammoplastica di ingrandimento, SAI||22/04/2010 10:22|
85.5.1_V2002|85.51|Iniezione mammoplastica di ingrandimento monolaterale|Iniezione mammoplastica di ingrandimento monolaterale|C|0|1|||Iniezione mammoplastica di ingrandimento monolaterale||22/04/2010 10:22|
85.5.2_V2002|85.52|Iniezione mammoplastica di ingrandimento bilaterale|Iniezione mammoplastica di ingrandimento bilaterale|C|0|1|||Iniezione mammoplastica di ingrandimento bilaterale||22/04/2010 10:22|
85.5.3_V2002|85.53|Impianto di protesi monolaterale|Impianto di protesi monolaterale|C|0|1|||Impianto di protesi monolaterale||22/04/2010 10:22|
85.5.4_V2002|85.54|Impianto di protesi bilaterale|Impianto di protesi bilaterale|C|0|1|||Impianto di protesi bilaterale||22/04/2010 10:22|
85.6_V2002|85.6|Mastopessi|Mastopessi|S|0|1|||Mastopessi||22/04/2010 10:22|
85.7_V2002|85.7|Ricostruzione totale della mammella|Ricostruzione totale della mammella|S|0|1|||Ricostruzione totale della mammella||22/04/2010 10:22|
85.8_V2002|85.8|Altri interventi di riparazione e plastica sulla mammella|Altri interventi di riparazione e plastica sulla mammella|S|0|1|||Altri interventi di riparazione e plastica sulla mammella||22/04/2010 10:22|
85.8.1_V2002|85.81|Sutura di lacerazione della mammella|Sutura di lacerazione della mammella|C|0|1|||Sutura di lacerazione della mammella||22/04/2010 10:22|
85.8.2_V2002|85.82|Innesto a spessore parziale nella mammella|Innesto a spessore parziale nella mammella|C|0|1|||Innesto a spessore parziale nella mammella||22/04/2010 10:22|
85.8.3_V2002|85.83|Innesto a tutto spessore nella mammella|Innesto a tutto spessore nella mammella|C|0|1|||Innesto a tutto spessore nella mammella||22/04/2010 10:22|
85.8.4_V2002|85.84|Innesto peduncolato della mammella|Innesto peduncolato della mammella|C|0|1|||Innesto peduncolato della mammella||22/04/2010 10:22|
85.8.5_V2002|85.85|Ricostruzione con lembo muscolare o muscolocutaneo della mammella|Ricostruzione con lembo muscolare o muscolocutaneo della mammella|C|0|1|||Ricostruzione con lembo muscolare o muscolocutaneo della mammella||22/04/2010 10:22|
85.8.6_V2002|85.86|Trasposizione del capezzolo|Trasposizione del capezzolo|C|0|1|||Trasposizione del capezzolo||22/04/2010 10:22|
85.8.7_V2002|85.87|Altra riparazione o ricostruzione del capezzolo|Altra riparazione o ricostruzione del capezzolo|C|0|1|||Altra riparazione o ricostruzione del capezzolo||22/04/2010 10:22|
85.8.9_V2002|85.89|Altra mammoplastica|Altra mammoplastica|C|0|1|||Altra mammoplastica||22/04/2010 10:22|
85.9_V2002|85.9|Altri interventi sulla mammella|Altri interventi sulla mammella|S|0|1|||Altri interventi sulla mammella||22/04/2010 10:22|
85.9.1_V2002|85.91|Aspirazione della mammella|Aspirazione della mammella|C|0|1|||Aspirazione della mammella||22/04/2010 10:22|
85.9.2_V2002|85.92|Iniezione di sostanze terapeutiche nella mammella|Iniezione di sostanze terapeutiche nella mammella|C|0|1|||Iniezione di sostanze terapeutiche nella mammella||22/04/2010 10:22|
85.9.3_V2002|85.93|Revisione di protesi della mammella|Revisione di protesi della mammella|C|0|1|||Revisione di protesi della mammella||22/04/2010 10:22|
85.9.4_V2002|85.94|Rimozione di protesi della mammella|Rimozione di protesi della mammella|C|0|1|||Rimozione di protesi della mammella||22/04/2010 10:22|
85.9.5_V2002|85.95|Inserzione di espansore tessutale nella mammella|Inserzione di espansore tessutale nella mammella|C|0|1|||Inserzione di espansore tessutale nella mammella||22/04/2010 10:22|
85.9.6_V2002|85.96|Rimozione di espansore tessutale dalla mammella|Rimozione di espansore tessutale dalla mammella|C|0|1|||Rimozione di espansore tessutale dalla mammella||22/04/2010 10:22|
85.9.9_V2002|85.99|Altri interventi sulla mammella|Altri interventi sulla mammella|C|0|1|||Altri interventi sulla mammella||22/04/2010 10:22|
86_V2002|-|Interventi sulla cute e sul tessuto sottocutaneo|Interventi sulla cute e sul tessuto sottocutaneo|T|0|1|||Interventi sulla cute e sul tessuto sottocutaneo||22/04/2010 10:22|
86.0_V2002|86.0|Incisione della cute e del tessuto sottocutaneo|Incisione della cute e del tessuto sottocutaneo|S|0|1|||Incisione della cute e del tessuto sottocutaneo||22/04/2010 10:22|
86.0.1_V2002|86.01|Aspirazione della cute e del tessuto sottocutaneo|Aspirazione della cute e del tessuto sottocutaneo|C|0|1|||Aspirazione della cute e del tessuto sottocutaneo||22/04/2010 10:22|
86.0.2_V2002|86.02|Iniezione o tatuaggio di lesioni o difetti della cute|Iniezione o tatuaggio di lesioni o difetti della cute|C|0|1|||Iniezione o tatuaggio di lesioni o difetti della cute||22/04/2010 10:22|
86.0.3_V2002|86.03|Incisione di cisti o seno pilonidale|Incisione di cisti o seno pilonidale|C|0|1|||Incisione di cisti o seno pilonidale||22/04/2010 10:22|
86.0.4_V2002|86.04|Altra incisione con drenaggio della cute e del tessuto sottocutaneo|Altra incisione con drenaggio della cute e del tessuto sottocutaneo|C|0|1|||Altra incisione con drenaggio della cute e del tessuto sottocutaneo||22/04/2010 10:22|
86.0.5_V2002|86.05|Incisione con rimozione di corpo estraneo da cute e tessuto sottocutaneo|Incisione con rimozione di corpo estraneo da cute e tessuto sottocutaneo|C|0|1|||Incisione con rimozione di corpo estraneo da cute e tessuto sottocutaneo||22/04/2010 10:22|
86.0.6_V2002|86.06|Inserzione di pompa di infusione totalmente impiantabile|Inserzione di pompa di infusione totalmente impiantabile|C|0|1|||Inserzione di pompa di infusione totalmente impiantabile||22/04/2010 10:22|
86.0.7_V2002|86.07|Inserzione di dispositivo di accesso vascolare totalmente impiantabile|Inserzione di dispositivo di accesso vascolare totalmente impiantabile|C|0|1|||Inserzione di dispositivo di accesso vascolare totalmente impiantabile||22/04/2010 10:22|
86.0.9_V2002|86.09|Altra incisione della cute e del tessuto sottocutaneo|Altra incisione della cute e del tessuto sottocutaneo|C|0|1|||Altra incisione della cute e del tessuto sottocutaneo||22/04/2010 10:22|
86.1_V2002|86.1|Procedure diagnostiche sulla cute e sul tessuto sottocutaneo|Procedure diagnostiche sulla cute e sul tessuto sottocutaneo|S|0|1|||Procedure diagnostiche sulla cute e sul tessuto sottocutaneo||22/04/2010 10:22|
86.1.1_V2002|86.11|Biopsia della cute e del tessuto sottocutaneo|Biopsia della cute e del tessuto sottocutaneo|C|0|1|||Biopsia della cute e del tessuto sottocutaneo||22/04/2010 10:22|
86.1.9_V2002|86.19|Altre procedure diagnostiche su cute e tessuto sottocutaneo|Altre procedure diagnostiche su cute e tessuto sottocutaneo|C|0|1|||Altre procedure diagnostiche su cute e tessuto sottocutaneo||22/04/2010 10:22|
