#CODEVALUEMODEL=CodeValueIcd9|CODESYSTEMID=2.16.840.1.113883.6.104|CODESYSTEMNAME=ICD9PROC|CODESYSTEMDISPLAYNAME=ICD9 PRESTAZIONI|VERSION=2002|DESCRIPTION=ICD9 Procedure Codes|LANGUAGE=it|AUTHORITYNAME=National Center for Health Statistics|AUTHORITYDESCRIPTION=World Health Organization|AUTHORITYCONTACTINFORMATION=http://www.cdc.gov/nchs/icd9.htm|VALIDFROM=22/04/2010 10:22
37.7_V2002|37.7|Inserzione, revisione, sostituzione, rimozione di elettrodo di pace-maker, inserzione di sistema di pace-maker temporaneo, revisione di tasca|Inserzione, revisione, sostituzione, rimozione di elettrodo di pace-maker, inserzione di sistema di pace-maker temporaneo, revisione di tasca|S|0|1|||Inserzione, revisione, sostituzione, rimozione di elettrodo di pace-maker, inserzione di sistema di pace-maker temporaneo, revisione di tasca||22/04/2010 10:22|
37.7.0_V2002|37.70|Inserzione iniziale di elettrodo non altrimenti specificato|Inserzione iniziale di elettrodo non altrimenti specificato|C|0|1|||Inserzione iniziale di elettrodo non altrimenti specificato||22/04/2010 10:22|
37.7.1_V2002|37.71|Inserzione iniziale di elettrodo transvenoso nel ventricolo|Inserzione iniziale di elettrodo transvenoso nel ventricolo|C|0|1|||Inserzione iniziale di elettrodo transvenoso nel ventricolo||22/04/2010 10:22|
37.7.2_V2002|37.72|Inserzione iniziale di elettrodi transvenosi nell'atrio e nel ventricolo|Inserzione iniziale di elettrodi transvenosi nell'atrio e nel ventricolo|C|0|1|||Inserzione iniziale di elettrodi transvenosi nell'atrio e nel ventricolo||22/04/2010 10:22|
37.7.3_V2002|37.73|Inserzione iniziale di elettrodo transvenoso nell'atrio|Inserzione iniziale di elettrodo transvenoso nell'atrio|C|0|1|||Inserzione iniziale di elettrodo transvenoso nell'atrio||22/04/2010 10:22|
37.7.4_V2002|37.74|Inserzione o riposizionamento di elettrodo epicardico nell'epicardio|Inserzione o riposizionamento di elettrodo epicardico nell'epicardio|C|0|1|||Inserzione o riposizionamento di elettrodo epicardico nell'epicardio||22/04/2010 10:22|
37.7.5_V2002|37.75|Revisione di elettrodo|Revisione di elettrodo|C|0|1|||Revisione di elettrodo||22/04/2010 10:22|
37.7.6_V2002|37.76|Riposizionamento di elettrodo transvenoso atriale e/o ventricolare|Riposizionamento di elettrodo transvenoso atriale e/o ventricolare|C|0|1|||Riposizionamento di elettrodo transvenoso atriale e/o ventricolare||22/04/2010 10:22|
37.7.7_V2002|37.77|Rimozione di elettrodo senza riposizionamento|Rimozione di elettrodo senza riposizionamento|C|0|1|||Rimozione di elettrodo senza riposizionamento||22/04/2010 10:22|
37.7.8_V2002|37.78|Inserzione di pace-maker transvenoso temporaneo|Inserzione di pace-maker transvenoso temporaneo|C|0|1|||Inserzione di pace-maker transvenoso temporaneo||22/04/2010 10:22|
37.7.9_V2002|37.79|Revisione o riposizionamento di tasca di pace-maker|Revisione o riposizionamento di tasca di pace-maker|C|0|1|||Revisione o riposizionamento di tasca di pace-maker||22/04/2010 10:22|
37.8_V2002|37.8|Inserzione, sostituzione, revisione e rimozione di pace-maker cardiaco|Inserzione, sostituzione, revisione e rimozione di pace-maker cardiaco|S|0|1|||Inserzione, sostituzione, revisione e rimozione di pace-maker cardiaco||22/04/2010 10:22|
37.8.0_V2002|37.80|Inserzione di pace-maker permanente, iniziale o sostituzione, tipo di strumento non specificato|Inserzione di pace-maker permanente, iniziale o sostituzione, tipo di strumento non specificato|C|0|1|||Inserzione di pace-maker permanente, iniziale o sostituzione, tipo di strumento non specificato||22/04/2010 10:22|
37.8.1_V2002|37.81|Inserzione iniziale di apparecchio a camera singola, non specificato come frequenza di risposta|Inserzione iniziale di apparecchio a camera singola, non specificato come frequenza di risposta|C|0|1|||Inserzione iniziale di apparecchio a camera singola, non specificato come frequenza di risposta||22/04/2010 10:22|
37.8.2_V2002|37.82|Inserzione iniziale di apparecchio a camera singola, frequenza di risposta|Inserzione iniziale di apparecchio a camera singola, frequenza di risposta|C|0|1|||Inserzione iniziale di apparecchio a camera singola, frequenza di risposta||22/04/2010 10:22|
37.8.3_V2002|37.83|Inserzione iniziale di apparecchio a camera doppia, apparecchio sequenziale atrio-ventricolo|Inserzione iniziale di apparecchio a camera doppia, apparecchio sequenziale atrio-ventricolo|C|0|1|||Inserzione iniziale di apparecchio a camera doppia, apparecchio sequenziale atrio-ventricolo||22/04/2010 10:22|
37.8.5_V2002|37.85|Sostituzione di un qualsiasi pace-maker con apparecchio a camera singola non specificato come frequenza di risposta|Sostituzione di un qualsiasi pace-maker con apparecchio a camera singola non specificato come frequenza di risposta|C|0|1|||Sostituzione di un qualsiasi pace-maker con apparecchio a camera singola non specificato come frequenza di risposta||22/04/2010 10:22|
37.8.6_V2002|37.86|Sostituzione di un qualsiasi pace-maker con apparecchio a camera singola, frequenza di risposta|Sostituzione di un qualsiasi pace-maker con apparecchio a camera singola, frequenza di risposta|C|0|1|||Sostituzione di un qualsiasi pace-maker con apparecchio a camera singola, frequenza di risposta||22/04/2010 10:22|
37.8.7_V2002|37.87|Sostituzione di un qualsiasi pace-maker con apparecchio a camera doppia|Sostituzione di un qualsiasi pace-maker con apparecchio a camera doppia|C|0|1|||Sostituzione di un qualsiasi pace-maker con apparecchio a camera doppia||22/04/2010 10:22|
37.8.9_V2002|37.89|Revisione o rimozione di pace-maker|Revisione o rimozione di pace-maker|C|0|1|||Revisione o rimozione di pace-maker||22/04/2010 10:22|
37.9_V2002|37.9|Altri interventi sul cuore e sul pericardio|Altri interventi sul cuore e sul pericardio|S|0|1|||Altri interventi sul cuore e sul pericardio||22/04/2010 10:22|
37.9.1_V2002|37.91|Massaggio cardiaco a torace aperto|Massaggio cardiaco a torace aperto|C|0|1|||Massaggio cardiaco a torace aperto||22/04/2010 10:22|
37.9.2_V2002|37.92|Iniezione intracardiaca di sostanze terapeutiche|Iniezione intracardiaca di sostanze terapeutiche|C|0|1|||Iniezione intracardiaca di sostanze terapeutiche||22/04/2010 10:22|
37.9.3_V2002|37.93|Iniezione di sostanze terapeutiche nel pericardio|Iniezione di sostanze terapeutiche nel pericardio|C|0|1|||Iniezione di sostanze terapeutiche nel pericardio||22/04/2010 10:22|
37.9.4_V2002|37.94|Impianto o sostituzione di defibrillatore automatico, sistema totale [AICD]|Impianto o sostituzione di defibrillatore automatico, sistema totale [AICD]|C|0|1|||Impianto o sostituzione di defibrillatore automatico, sistema totale [AICD]||22/04/2010 10:22|
37.9.5_V2002|37.95|Impianto di soli elettrodi di defribillatore automatico|Impianto di soli elettrodi di defribillatore automatico|C|0|1|||Impianto di soli elettrodi di defribillatore automatico||22/04/2010 10:22|
37.9.6_V2002|37.96|Impianto di solo generatore di impulsi di defibrillatore automatico|Impianto di solo generatore di impulsi di defibrillatore automatico|C|0|1|||Impianto di solo generatore di impulsi di defibrillatore automatico||22/04/2010 10:22|
37.9.7_V2002|37.97|Sostituzione del solo elettrodo del defibrillatore automatico|Sostituzione del solo elettrodo del defibrillatore automatico|C|0|1|||Sostituzione del solo elettrodo del defibrillatore automatico||22/04/2010 10:22|
37.9.8_V2002|37.98|Sostituzione del solo generatore di impulsi del defibrillatore automatico|Sostituzione del solo generatore di impulsi del defibrillatore automatico|C|0|1|||Sostituzione del solo generatore di impulsi del defibrillatore automatico||22/04/2010 10:22|
37.9.9_V2002|37.99|Altri interventi sul cuore e sul pericardio|Altri interventi sul cuore e sul pericardio|C|0|1|||Altri interventi sul cuore e sul pericardio||22/04/2010 10:22|
38_V2002|-|Incisione, asportazione ed occlusione di vasi|Incisione, asportazione ed occlusione di vasi|T|0|1|||Incisione, asportazione ed occlusione di vasi||22/04/2010 10:22|
38.0_V2002|38.0|Incisione di vasi|Incisione di vasi|S|0|1|||Incisione di vasi||22/04/2010 10:22|
38.0.0_V2002|38.00|Incisione di vasi, sede non specificata|Incisione di vasi, sede non specificata|C|0|1|||Incisione di vasi, sede non specificata||22/04/2010 10:22|
38.0.1_V2002|38.01|Incisione di vasi intracranici|Incisione di vasi intracranici|C|0|1|||Incisione di vasi intracranici||22/04/2010 10:22|
38.0.2_V2002|38.02|Incisione di altri vasi del capo e del collo|Incisione di altri vasi del capo e del collo|C|0|1|||Incisione di altri vasi del capo e del collo||22/04/2010 10:22|
38.0.3_V2002|38.03|Incisione di altri vasi dell'arto superiore|Incisione di altri vasi dell'arto superiore|C|0|1|||Incisione di altri vasi dell'arto superiore||22/04/2010 10:22|
38.0.4_V2002|38.04|Incisione dell'aorta|Incisione dell'aorta|C|0|1|||Incisione dell'aorta||22/04/2010 10:22|
38.0.5_V2002|38.05|Incisione di altri vasi toracici|Incisione di altri vasi toracici|C|0|1|||Incisione di altri vasi toracici||22/04/2010 10:22|
38.0.6_V2002|38.06|Incisione di arterie addominali|Incisione di arterie addominali|C|0|1|||Incisione di arterie addominali||22/04/2010 10:22|
38.0.7_V2002|38.07|Incisione di vene addominali|Incisione di vene addominali|C|0|1|||Incisione di vene addominali||22/04/2010 10:22|
38.0.8_V2002|38.08|Incisione di arterie dell'arto inferiore|Incisione di arterie dell'arto inferiore|C|0|1|||Incisione di arterie dell'arto inferiore||22/04/2010 10:22|
38.0.9_V2002|38.09|Incisione di vene dell'arto inferiore|Incisione di vene dell'arto inferiore|C|0|1|||Incisione di vene dell'arto inferiore||22/04/2010 10:22|
38.1_V2002|38.1|Endoarteriectomia|Endoarteriectomia|S|0|1|||Endoarteriectomia||22/04/2010 10:22|
38.1.0_V2002|38.10|Endoarteriectomia, sede non specificata|Endoarteriectomia, sede non specificata|C|0|1|||Endoarteriectomia, sede non specificata||22/04/2010 10:22|
38.1.1_V2002|38.11|Endoarteriectomia dei vasi intracranici|Endoarteriectomia dei vasi intracranici|C|0|1|||Endoarteriectomia dei vasi intracranici||22/04/2010 10:22|
38.1.2_V2002|38.12|Endoarteriectomia di altri vasi del capo e del collo|Endoarteriectomia di altri vasi del capo e del collo|C|0|1|||Endoarteriectomia di altri vasi del capo e del collo||22/04/2010 10:22|
38.1.3_V2002|38.13|Endoarteriectomia di vasi dell'arto superiore|Endoarteriectomia di vasi dell'arto superiore|C|0|1|||Endoarteriectomia di vasi dell'arto superiore||22/04/2010 10:22|
38.1.4_V2002|38.14|Endoarteriectomia dell'aorta|Endoarteriectomia dell'aorta|C|0|1|||Endoarteriectomia dell'aorta||22/04/2010 10:22|
38.1.5_V2002|38.15|Endoarteriectomia di altri vasi toracici|Endoarteriectomia di altri vasi toracici|C|0|1|||Endoarteriectomia di altri vasi toracici||22/04/2010 10:22|
38.1.6_V2002|38.16|Endoarteriectomia delle arterie addominali|Endoarteriectomia delle arterie addominali|C|0|1|||Endoarteriectomia delle arterie addominali||22/04/2010 10:22|
38.1.8_V2002|38.18|Endoarteriectomia delle arterie dell'arto inferiore|Endoarteriectomia delle arterie dell'arto inferiore|C|0|1|||Endoarteriectomia delle arterie dell'arto inferiore||22/04/2010 10:22|
38.2_V2002|38.2|Procedure diagnostiche sui vasi sanguigni|Procedure diagnostiche sui vasi sanguigni|S|0|1|||Procedure diagnostiche sui vasi sanguigni||22/04/2010 10:22|
38.2.1_V2002|38.21|Biopsia dei vasi sanguigni|Biopsia dei vasi sanguigni|C|0|1|||Biopsia dei vasi sanguigni||22/04/2010 10:22|
38.2.2_V2002|38.22|Angioscopia percutanea|Angioscopia percutanea|C|0|1|||Angioscopia percutanea||22/04/2010 10:22|
38.2.9_V2002|38.29|Altre procedure diagnostiche sui vasi sanguigni|Altre procedure diagnostiche sui vasi sanguigni|C|0|1|||Altre procedure diagnostiche sui vasi sanguigni||22/04/2010 10:22|
38.3_V2002|38.3|Resezione di vasi con anastomosi|Resezione di vasi con anastomosi|S|0|1|||Resezione di vasi con anastomosi||22/04/2010 10:22|
38.3.0_V2002|38.30|Resezione di vasi con anastomosi, sede non specificata|Resezione di vasi con anastomosi, sede non specificata|C|0|1|||Resezione di vasi con anastomosi, sede non specificata||22/04/2010 10:22|
38.3.1_V2002|38.31|Resezione di vasi intracranici con anastomosi|Resezione di vasi intracranici con anastomosi|C|0|1|||Resezione di vasi intracranici con anastomosi||22/04/2010 10:22|
38.3.2_V2002|38.32|Resezione di altri vasi del capo e collo con anastomosi|Resezione di altri vasi del capo e collo con anastomosi|C|0|1|||Resezione di altri vasi del capo e collo con anastomosi||22/04/2010 10:22|
38.3.3_V2002|38.33|Resezione di vasi dell'arto superiore con anastomosi|Resezione di vasi dell'arto superiore con anastomosi|C|0|1|||Resezione di vasi dell'arto superiore con anastomosi||22/04/2010 10:22|
38.3.4_V2002|38.34|Resezione dell'aorta con anastomosi|Resezione dell'aorta con anastomosi|C|0|1|||Resezione dell'aorta con anastomosi||22/04/2010 10:22|
38.3.5_V2002|38.35|Resezione di altri vasi toracici con anastomosi|Resezione di altri vasi toracici con anastomosi|C|0|1|||Resezione di altri vasi toracici con anastomosi||22/04/2010 10:22|
38.3.6_V2002|38.36|Resezione di arterie addominali con anastomosi|Resezione di arterie addominali con anastomosi|C|0|1|||Resezione di arterie addominali con anastomosi||22/04/2010 10:22|
38.3.7_V2002|38.37|Resezione di vene addominali con anastomosi|Resezione di vene addominali con anastomosi|C|0|1|||Resezione di vene addominali con anastomosi||22/04/2010 10:22|
38.3.8_V2002|38.38|Resezione di arterie dell'arto inferiore con anastomosi|Resezione di arterie dell'arto inferiore con anastomosi|C|0|1|||Resezione di arterie dell'arto inferiore con anastomosi||22/04/2010 10:22|
38.3.9_V2002|38.39|Resezione di vene dell'arto inferiore con anastomosi|Resezione di vene dell'arto inferiore con anastomosi|C|0|1|||Resezione di vene dell'arto inferiore con anastomosi||22/04/2010 10:22|
38.4_V2002|38.4|Resezione di vasi con sostituzione|Resezione di vasi con sostituzione|S|0|1|||Resezione di vasi con sostituzione||22/04/2010 10:22|
38.4.0_V2002|38.40|Resezione di vasi con sostituzione, sede non specificata|Resezione di vasi con sostituzione, sede non specificata|C|0|1|||Resezione di vasi con sostituzione, sede non specificata||22/04/2010 10:22|
38.4.1_V2002|38.41|Resezione di vasi intracranici con sostituzione|Resezione di vasi intracranici con sostituzione|C|0|1|||Resezione di vasi intracranici con sostituzione||22/04/2010 10:22|
38.4.2_V2002|38.42|Resezione di altri vasi del capo e collo con sostituzione|Resezione di altri vasi del capo e collo con sostituzione|C|0|1|||Resezione di altri vasi del capo e collo con sostituzione||22/04/2010 10:22|
38.4.3_V2002|38.43|Resezione di vasi dell'arto superiore con sostituzione|Resezione di vasi dell'arto superiore con sostituzione|C|0|1|||Resezione di vasi dell'arto superiore con sostituzione||22/04/2010 10:22|
38.4.4_V2002|38.44|Resezione dell'aorta, addominale con sostituzione|Resezione dell'aorta, addominale con sostituzione|C|0|1|||Resezione dell'aorta, addominale con sostituzione||22/04/2010 10:22|
38.4.5_V2002|38.45|Resezione di altri vasi toracici con sostituzione|Resezione di altri vasi toracici con sostituzione|C|0|1|||Resezione di altri vasi toracici con sostituzione||22/04/2010 10:22|
38.4.6_V2002|38.46|Resezione di arterie addominali con sostituzione|Resezione di arterie addominali con sostituzione|C|0|1|||Resezione di arterie addominali con sostituzione||22/04/2010 10:22|
38.4.7_V2002|38.47|Resezione di vene addominali con sostituzione|Resezione di vene addominali con sostituzione|C|0|1|||Resezione di vene addominali con sostituzione||22/04/2010 10:22|
38.4.8_V2002|38.48|Resezione di arterie dell'arto inferiore con sostituzione|Resezione di arterie dell'arto inferiore con sostituzione|C|0|1|||Resezione di arterie dell'arto inferiore con sostituzione||22/04/2010 10:22|
38.4.9_V2002|38.49|Resezione di vene dell'arto inferiore con sostituzione|Resezione di vene dell'arto inferiore con sostituzione|C|0|1|||Resezione di vene dell'arto inferiore con sostituzione||22/04/2010 10:22|
38.5_V2002|38.5|Legatura e stripping di vene varicose|Legatura e stripping di vene varicose|S|0|1|||Legatura e stripping di vene varicose||22/04/2010 10:22|
38.5.0_V2002|38.50|Legatura e stripping di vene varicose, sede non specificata|Legatura e stripping di vene varicose, sede non specificata|C|0|1|||Legatura e stripping di vene varicose, sede non specificata||22/04/2010 10:22|
38.5.1_V2002|38.51|Legatura di vene varicose intracraniche|Legatura di vene varicose intracraniche|C|0|1|||Legatura di vene varicose intracraniche||22/04/2010 10:22|
38.5.2_V2002|38.52|Legatura di altre vene varicose del capo e del collo|Legatura di altre vene varicose del capo e del collo|C|0|1|||Legatura di altre vene varicose del capo e del collo||22/04/2010 10:22|
38.5.3_V2002|38.53|Legatura e stripping di vene varicose dell'arto superiore|Legatura e stripping di vene varicose dell'arto superiore|C|0|1|||Legatura e stripping di vene varicose dell'arto superiore||22/04/2010 10:22|
38.5.5_V2002|38.55|Legatura di vene varicose toraciche|Legatura di vene varicose toraciche|C|0|1|||Legatura di vene varicose toraciche||22/04/2010 10:22|
38.5.7_V2002|38.57|Legatura di vene varicose addominali|Legatura di vene varicose addominali|C|0|1|||Legatura di vene varicose addominali||22/04/2010 10:22|
38.5.9_V2002|38.59|Legatura e stripping di vene varicose dell'arto inferiore|Legatura e stripping di vene varicose dell'arto inferiore|C|0|1|||Legatura e stripping di vene varicose dell'arto inferiore||22/04/2010 10:22|
38.6_V2002|38.6|Altra asportazione di vasi|Altra asportazione di vasi|S|0|1|||Altra asportazione di vasi||22/04/2010 10:22|
38.6.0_V2002|38.60|Altra asportazione di vasi, sede non specificata|Altra asportazione di vasi, sede non specificata|C|0|1|||Altra asportazione di vasi, sede non specificata||22/04/2010 10:22|
38.6.1_V2002|38.61|Altra asportazione di vasi intracranici|Altra asportazione di vasi intracranici|C|0|1|||Altra asportazione di vasi intracranici||22/04/2010 10:22|
38.6.2_V2002|38.62|Altra asportazione di altri vasi del capo e del collo|Altra asportazione di altri vasi del capo e del collo|C|0|1|||Altra asportazione di altri vasi del capo e del collo||22/04/2010 10:22|
38.6.3_V2002|38.63|Altra asportazione di vasi dell'arto superiore|Altra asportazione di vasi dell'arto superiore|C|0|1|||Altra asportazione di vasi dell'arto superiore||22/04/2010 10:22|
38.6.4_V2002|38.64|Altra asportazione dell'aorta, addominale|Altra asportazione dell'aorta, addominale|C|0|1|||Altra asportazione dell'aorta, addominale||22/04/2010 10:22|
38.6.5_V2002|38.65|Altra asportazione di altri vasi toracici|Altra asportazione di altri vasi toracici|C|0|1|||Altra asportazione di altri vasi toracici||22/04/2010 10:22|
38.6.6_V2002|38.66|Altra asportazione di arterie addominali|Altra asportazione di arterie addominali|C|0|1|||Altra asportazione di arterie addominali||22/04/2010 10:22|
38.6.7_V2002|38.67|Altra asportazione di vene addominali|Altra asportazione di vene addominali|C|0|1|||Altra asportazione di vene addominali||22/04/2010 10:22|
38.6.8_V2002|38.68|Altra asportazione di arterie dell'arto inferiore|Altra asportazione di arterie dell'arto inferiore|C|0|1|||Altra asportazione di arterie dell'arto inferiore||22/04/2010 10:22|
38.6.9_V2002|38.69|Altra asportazione di vene dell'arto inferiore|Altra asportazione di vene dell'arto inferiore|C|0|1|||Altra asportazione di vene dell'arto inferiore||22/04/2010 10:22|
38.7_V2002|38.7|Interruzione della vena cava|Interruzione della vena cava|S|0|1|||Interruzione della vena cava||22/04/2010 10:22|
38.8_V2002|38.8|Altra occlusione chirurgica di vasi|Altra occlusione chirurgica di vasi|S|0|1|||Altra occlusione chirurgica di vasi||22/04/2010 10:22|
38.8.0_V2002|38.80|Altra occlusione chirurgica di vasi, sede non specificata|Altra occlusione chirurgica di vasi, sede non specificata|C|0|1|||Altra occlusione chirurgica di vasi, sede non specificata||22/04/2010 10:22|
38.8.1_V2002|38.81|Altra occlusione chirurgica di vasi intracranici|Altra occlusione chirurgica di vasi intracranici|C|0|1|||Altra occlusione chirurgica di vasi intracranici||22/04/2010 10:22|
38.8.2_V2002|38.82|Altra occlusione chirurgica di altri vasi del capo e del collo|Altra occlusione chirurgica di altri vasi del capo e del collo|C|0|1|||Altra occlusione chirurgica di altri vasi del capo e del collo||22/04/2010 10:22|
38.8.3_V2002|38.83|Altra occlusione chirurgica di vasi dell'arto superiore|Altra occlusione chirurgica di vasi dell'arto superiore|C|0|1|||Altra occlusione chirurgica di vasi dell'arto superiore||22/04/2010 10:22|
38.8.4_V2002|38.84|Altra occlusione chirurgica dell'aorta, addominale|Altra occlusione chirurgica dell'aorta, addominale|C|0|1|||Altra occlusione chirurgica dell'aorta, addominale||22/04/2010 10:22|
38.8.5_V2002|38.85|Altra occlusione chirurgica di altri vasi toracici|Altra occlusione chirurgica di altri vasi toracici|C|0|1|||Altra occlusione chirurgica di altri vasi toracici||22/04/2010 10:22|
38.8.6_V2002|38.86|Altra occlusione chirurgica di arterie addominali|Altra occlusione chirurgica di arterie addominali|C|0|1|||Altra occlusione chirurgica di arterie addominali||22/04/2010 10:22|
38.8.7_V2002|38.87|Altra occlusione chirurgica di vene addominali iliaca, portale, renale, splenica, vena cava inferiore|Altra occlusione chirurgica di vene addominali iliaca, portale, renale, splenica, vena cava inferiore|C|0|1|||Altra occlusione chirurgica di vene addominali iliaca, portale, renale, splenica, vena cava inferiore||22/04/2010 10:22|
38.8.8_V2002|38.88|Altra occlusione chirurgica di arterie arto inferiore|Altra occlusione chirurgica di arterie arto inferiore|C|0|1|||Altra occlusione chirurgica di arterie arto inferiore||22/04/2010 10:22|
38.8.9_V2002|38.89|Altra occlusione chirurgica di vene arto inferiore|Altra occlusione chirurgica di vene arto inferiore|C|0|1|||Altra occlusione chirurgica di vene arto inferiore||22/04/2010 10:22|
38.9_V2002|38.9|Puntura di vasi|Puntura di vasi|S|0|1|||Puntura di vasi||22/04/2010 10:22|
38.9.1_V2002|38.91|Cateterismo arterioso|Cateterismo arterioso|C|0|1|||Cateterismo arterioso||22/04/2010 10:22|
38.9.2_V2002|38.92|Cateterismo della vena ombelicale|Cateterismo della vena ombelicale|C|0|1|||Cateterismo della vena ombelicale||22/04/2010 10:22|
38.9.3_V2002|38.93|Altro cateterismo venoso non classificato altrove|Altro cateterismo venoso non classificato altrove|C|0|1|||Altro cateterismo venoso non classificato altrove||22/04/2010 10:22|
38.9.4_V2002|38.94|Preparazione di vena per incannulamento|Preparazione di vena per incannulamento|C|0|1|||Preparazione di vena per incannulamento||22/04/2010 10:22|
38.9.5_V2002|38.95|Cateterismo venoso per dialisi renale|Cateterismo venoso per dialisi renale|C|0|1|||Cateterismo venoso per dialisi renale||22/04/2010 10:22|
38.9.8_V2002|38.98|Altra puntura di arteria|Altra puntura di arteria|C|0|1|||Altra puntura di arteria||22/04/2010 10:22|
38.9.9_V2002|38.99|Altra puntura di vena|Altra puntura di vena|C|0|1|||Altra puntura di vena||22/04/2010 10:22|
39_V2002|-|Altri interventi sui vasi -|Altri interventi sui vasi|T|0|1|||Altri interventi sui vasi||22/04/2010 10:22|
39.0_V2002|39.0|Anastomosi arterioso sistemico polmonare|Anastomosi arterioso sistemico polmonare|S|0|1|||Anastomosi arterioso sistemico polmonare||22/04/2010 10:22|
39.1_V2002|39.1|Anastomosi venosa intraaddominale|Anastomosi venosa intraaddominale|S|0|1|||Anastomosi venosa intraaddominale||22/04/2010 10:22|
39.2_V2002|39.2|Altre anastomosi o bypass vascolari|Altre anastomosi o bypass vascolari|S|0|1|||Altre anastomosi o bypass vascolari||22/04/2010 10:22|
39.2.1_V2002|39.21|Anastomosi vena cava e arteria polmonare|Anastomosi vena cava e arteria polmonare|C|0|1|||Anastomosi vena cava e arteria polmonare||22/04/2010 10:22|
39.2.2_V2002|39.22|Bypass aorto-succlavio-carotideo|Bypass aorto-succlavio-carotideo|C|0|1|||Bypass aorto-succlavio-carotideo||22/04/2010 10:22|
39.2.3_V2002|39.23|Altra anastomosi o bypass vascolare intratoracico|Altra anastomosi o bypass vascolare intratoracico|C|0|1|||Altra anastomosi o bypass vascolare intratoracico||22/04/2010 10:22|
39.2.4_V2002|39.24|Bypass aorto-renale|Bypass aorto-renale|C|0|1|||Bypass aorto-renale||22/04/2010 10:22|
39.2.5_V2002|39.25|Bypass aorto-iliaco-femorale|Bypass aorto-iliaco-femorale|C|0|1|||Bypass aorto-iliaco-femorale||22/04/2010 10:22|
39.2.6_V2002|39.26|Altri anastomosi o bypass vascolari intraaddominali|Altri anastomosi o bypass vascolari intraaddominali|C|0|1|||Altri anastomosi o bypass vascolari intraaddominali||22/04/2010 10:22|
39.2.7_V2002|39.27|Arteriovenostomia per dialisi renale|Arteriovenostomia per dialisi renale|C|0|1|||Arteriovenostomia per dialisi renale||22/04/2010 10:22|
39.2.8_V2002|39.28|Bypass vascolare extracranico-intracranico (EC-IC)|Bypass vascolare extracranico-intracranico (EC-IC)|C|0|1|||Bypass vascolare extracranico-intracranico (EC-IC)||22/04/2010 10:22|
39.2.9_V2002|39.29|Altri anastomosi o bypass vascolari (periferici)|Altri anastomosi o bypass vascolari (periferici)|C|0|1|||Altri anastomosi o bypass vascolari (periferici)||22/04/2010 10:22|
39.3_V2002|39.3|Sutura di vasi|Sutura di vasi|S|0|1|||Sutura di vasi||22/04/2010 10:22|
39.3.0_V2002|39.30|Sutura di vasi sanguigni non specificati|Sutura di vasi sanguigni non specificati|C|0|1|||Sutura di vasi sanguigni non specificati||22/04/2010 10:22|
39.3.1_V2002|39.31|Sutura di arteria|Sutura di arteria|C|0|1|||Sutura di arteria||22/04/2010 10:22|
39.3.2_V2002|39.32|Sutura di vena|Sutura di vena|C|0|1|||Sutura di vena||22/04/2010 10:22|
39.4_V2002|39.4|Revisione di interventi vascolari|Revisione di interventi vascolari|S|0|1|||Revisione di interventi vascolari||22/04/2010 10:22|
39.4.1_V2002|39.41|Controllo di emorragia a seguito di chirurgia vascolare|Controllo di emorragia a seguito di chirurgia vascolare|C|0|1|||Controllo di emorragia a seguito di chirurgia vascolare||22/04/2010 10:22|
